{"$schema":"https://json-schema.org/draft/2020-12/schema","$id":"https://scramjet.org/transform-hub/release-trust-policy/v1","type":"object","additionalProperties":false,"required":["schema","candidateAuthority","remote"],"properties":{"schema":{"const":"release-trust-policy.v1"},"candidateAuthority":{"const":"github-draft-release-id-and-signed-digest"},"decision":{"type":"string"},"limitations":{"type":"array","items":{"type":"string"}},"remote":{"type":"object","additionalProperties":false,"required":["status","repository","environmentAdminBypass","customAdmissionCheckRequired"],"properties":{"status":{"enum":["confirmed","unconfirmed"]},"repository":{"const":"scramjetorg/transform-hub"},"environmentAdminBypass":{"type":"boolean"},"customAdmissionCheckRequired":{"type":"boolean"},"branches":{"type":"object"},"candidateRelease":{"type":"object"},"assetRetention":{"type":"object"},"images":{"type":"string"},"npmTrustedPublisherDirectLatest":{"type":"string"}}}}}
